{
  "$schema": "./settings.schema.json",
  "project": {
    "companyName": "Your Company",
    "shortName": "co"
  },
  "plugin": {
    "name": "devenv-workflow",
    "marketplace": {
      "name": "devenv-workflow",
      "githubRepo": "your-org/your-devenv-workflow",
      "gitRemote": "git@github.com:your-org/your-devenv-workflow.git",
      "repoUrl": "https://github.com/your-org/your-devenv-workflow"
    }
  },
  "azureDevOps": {
    "orgUrl": "https://dev.azure.com/your-org",
    "project": "Your Project",
    "area": "Your Area",
    "defaultIteration": "Your Project"
  },
  "sync": {
    "peerRepo": null,
    "exclusions": {
      "global": [],
      "categories": {}
    },
    "nameTransforms": []
  }
}
